{
  "$schema": "https://json-schema.org/draft/2020-12/schema",
  "$id": "https://github.com/Cratis/AI/blob/main/distribution/profile-subscription.schema.json",
  "title": "Cratis AI profile subscription",
  "type": "object",
  "additionalProperties": false,
  "description": "A project-owned Cratis AI subscription. The legacy public- and engineering- namespaces declare their channel; the cratis/ namespace introduced by Cratis/AI#264 derives it, so channel is optional there and never hand-declared twice.",
  "required": [
    "schemaVersion",
    "version",
    "profiles",
    "harnesses",
    "updatePolicy",
    "projectContext"
  ],
  "oneOf": [
    {
      "title": "Declared public channel",
      "required": ["channel"],
      "properties": {
        "channel": {
          "const": "public"
        },
        "profiles": {
          "items": {
            "type": "string",
            "pattern": "^public-[a-z0-9]+(?:-[a-z0-9]+)*$"
          }
        }
      }
    },
    {
      "title": "Declared Cratis engineering channel",
      "required": ["channel"],
      "properties": {
        "channel": {
          "const": "cratis-engineering"
        },
        "profiles": {
          "items": {
            "type": "string",
            "pattern": "^engineering-[a-z0-9]+(?:-[a-z0-9]+)*$"
          }
        }
      }
    },
    {
      "title": "Derived channel from the cratis namespace",
      "properties": {
        "profiles": {
          "items": {
            "type": "string",
            "pattern": "^cratis(?:/[a-z0-9]+(?:-[a-z0-9]+)*)?$"
          }
        }
      }
    }
  ],
  "properties": {
    "schemaVersion": {
      "const": "1.0.0"
    },
    "channel": {
      "description": "Optional. Required with the public- and engineering- namespaces; derived from the profile namespace otherwise.",
      "enum": ["public", "cratis-engineering"]
    },
    "version": {
      "type": "string",
      "pattern": "^(0|[1-9][0-9]*)\\.(0|[1-9][0-9]*)\\.(0|[1-9][0-9]*)(?:-(?:0|[1-9][0-9]*|[0-9A-Za-z-]*[A-Za-z-][0-9A-Za-z-]*)(?:\\.(?:0|[1-9][0-9]*|[0-9A-Za-z-]*[A-Za-z-][0-9A-Za-z-]*))*)?(?:\\+[0-9A-Za-z-]+(?:\\.[0-9A-Za-z-]+)*)?$"
    },
    "profiles": {
      "type": "array",
      "minItems": 1,
      "uniqueItems": true,
      "items": {
        "type": "string",
        "pattern": "^(?:cratis(?:/[a-z0-9]+(?:-[a-z0-9]+)*)?|(?:public|engineering)-[a-z0-9]+(?:-[a-z0-9]+)*)$"
      }
    },
    "harnesses": {
      "type": "array",
      "minItems": 1,
      "uniqueItems": true,
      "items": {
        "enum": [
          "agent-skills",
          "agent-plugin",
          "claude",
          "codex",
          "copilot",
          "cursor",
          "deepcode",
          "deepseek-harness",
          "gemini",
          "grok",
          "junie",
          "kiro",
          "vscode",
          "qwen",
          "hermes",
          "openclaw",
          "grok-bot",
          "nanoclaw",
          "amp",
          "augment",
          "cline",
          "devin",
          "github-cli",
          "goose",
          "kilo",
          "opencode",
          "openhands",
          "replit",
          "visual-studio",
          "windsurf",
          "zed",
          "factory",
          "grok-native",
          "pi"
        ]
      }
    },
    "updatePolicy": {
      "const": "reviewed-pull-request"
    },
    "projectContext": {
      "type": "string",
      "enum": [".cratis/PROJECT.md", ".agents/PROJECT.md"]
    },
    "skillAllowlist": {
      "type": "array",
      "uniqueItems": true,
      "items": {
        "type": "string",
        "pattern": "^[a-z0-9]+(?:-[a-z0-9]+)*$"
      }
    },
    "skillDenylist": {
      "type": "array",
      "uniqueItems": true,
      "items": {
        "type": "string",
        "pattern": "^[a-z0-9]+(?:-[a-z0-9]+)*$"
      }
    }
  }
}
