{
  "schemaVersion": "1.0.0",
  "version": "1.0.0",
  "profiles": [
    "cratis/documentation",
    "cratis/engineering/typescript"
  ],
  "harnesses": [
    "claude",
    "codex",
    "copilot",
    "cursor",
    "pi"
  ],
  "updatePolicy": "reviewed-pull-request",
  "projectContext": ".cratis/PROJECT.md"
}
